{
  "schemaVersion": 1,
  "catalogId": "ruffneckk-d2r33-datatables-atlas-v1",
  "targetRuntime": {
    "version": "3.3.93847",
    "build": 93847,
    "architecture": "x86-64"
  },
  "corpus": {
    "workbenchPath": "reverse-engineering/d2r-3.2.92777",
    "provenanceBuild": 92777,
    "imageBase": "0x140000000",
    "canonicalImageSha256": "CC59119DC2A6C7D43D088098FC162EAFA4AE1299B2079126AEF43C1ACA914715",
    "analysisImageSha256": "673E8C0B2E89563E75525B24D137098EFD07B2DB4ED42ADEC56AA1ADDF0E63AB",
    "coveredBuilds": [
      {
        "build": 92777,
        "status": "byte-exact",
        "evidenceIds": ["workbench-manifest"]
      },
      {
        "build": 93847,
        "status": "byte-exact",
        "evidenceIds": ["governed-equivalence"]
      }
    ]
  },
  "dataTables": {
    "accessorRva": "0x300A90",
    "contextCount": 4,
    "globalEntryStride": "0x10",
    "evidenceIds": ["get-datatables-for-context"]
  },
  "scope": {
    "expectedTableIds": [
      "states",
      "skills",
      "item-stat-cost",
      "item-types",
      "objects",
      "items",
      "shrines"
    ],
    "excluded": [
      "callback tables and dispatch arrays",
      "hooks and runtime mutation",
      "save-format structures",
      "unproven full record layouts"
    ]
  },
  "evidence": [
    {
      "id": "workbench-manifest",
      "kind": "json-pointer",
      "path": "reverse-engineering/d2r-3.2.92777/workbench.json",
      "pointer": "/target",
      "expected": {
        "build": 92777,
        "architecture": "x86-64",
        "imageBase": "0x140000000"
      },
      "supports": ["coverage:92777", "corpus:identity"],
      "claims": {
        "coverage:92777": true,
        "corpus:identity": true
      }
    },
    {
      "id": "governed-equivalence",
      "kind": "text-witness",
      "path": "reverse-engineering/d2r-3.2.92777/findings.md",
      "needle": "La cible produit D2R 3.3.93847 réutilise le corpus natif vérifié provenant du",
      "supports": ["coverage:93847"],
      "claims": { "coverage:93847": true }
    },
    {
      "id": "get-datatables-for-context",
      "kind": "known-rva",
      "path": "reverse-engineering/d2r-3.2.92777/known-rvas.json",
      "name": "GetDataTablesForContext",
      "rva": "0x300A90",
      "supports": ["datatables:accessor", "datatables:contexts", "datatables:entry-stride"],
      "claims": {
        "datatables:accessor": "0x300A90",
        "datatables:contexts": 4,
        "datatables:entry-stride": "0x10"
      }
    },
    {
      "id": "states-stride",
      "kind": "known-rva",
      "path": "reverse-engineering/d2r-3.2.92777/known-rvas.json",
      "name": "DATATBLS_CompileStatesTxt_RecordStrideWitness",
      "rva": "0x3083D7",
      "supports": ["states:record-size"],
      "claims": { "states:record-size": "0x44" }
    },
    {
      "id": "states-records",
      "kind": "known-rva",
      "path": "reverse-engineering/d2r-3.2.92777/known-rvas.json",
      "name": "DATATBLS_CompileStatesTxt_VectorLayoutWitness",
      "rva": "0x30843C",
      "supports": ["states:records"],
      "claims": { "states:records": "0x290" }
    },
    {
      "id": "states-count",
      "kind": "known-rva",
      "path": "reverse-engineering/d2r-3.2.92777/known-rvas.json",
      "name": "STATES_ToggleState_DataTablesLayoutWitness",
      "rva": "0x3354E0",
      "supports": ["states:count"],
      "claims": { "states:count": "0x298" }
    },
    {
      "id": "states-overlay1",
      "kind": "known-rva",
      "path": "reverse-engineering/d2r-3.2.92777/known-rvas.json",
      "name": "DATATBLS_CompileStatesTxt_OverlayFieldWitness",
      "rva": "0x307EB3",
      "supports": ["states:field:overlay1"],
      "claims": {
        "states:field:overlay1": { "offset": "0x2", "size": 2, "type": "uint16_t" }
      }
    },
    {
      "id": "skills-layout",
      "kind": "known-rva",
      "path": "reverse-engineering/d2r-3.2.92777/known-rvas.json",
      "name": "DATATBLS_GetSkillsTxtRecordForContext",
      "rva": "0x97790",
      "supports": [
        "skills:records",
        "skills:count",
        "skills:record-size",
        "skills:field:flags",
        "skills:field:player-animation",
        "skills:field:sequence-transition"
      ],
      "claims": {
        "skills:records": "0x11B0",
        "skills:count": "0x11B8",
        "skills:record-size": "0x2EC",
        "skills:field:flags": { "offset": "0x24", "size": 8, "type": "uint64_t" },
        "skills:field:player-animation": { "offset": "0x30", "size": 1, "type": "uint8_t" },
        "skills:field:sequence-transition": { "offset": "0x32", "size": 1, "type": "uint8_t" }
      }
    },
    {
      "id": "skills-item-effect",
      "kind": "known-rva",
      "path": "reverse-engineering/d2r-3.2.92777/known-rvas.json",
      "name": "SKILLITEM_HandleItemEffectSkill",
      "rva": "0x589930",
      "supports": ["skills:field:item-effect"],
      "claims": {
        "skills:field:item-effect": { "offset": "0x20A", "size": 2, "type": "uint16_t" }
      }
    },
    {
      "id": "item-stat-cost-compile",
      "kind": "native-site",
      "path": "reverse-engineering/d2r-3.2.92777/isc12/native-sites.json",
      "siteId": "loader-generic-compile-call",
      "rva": "0x31EC7B",
      "supports": ["item-stat-cost:record-size"],
      "claims": { "item-stat-cost:record-size": "0x144" }
    },
    {
      "id": "item-stat-cost-count",
      "kind": "native-site",
      "path": "reverse-engineering/d2r-3.2.92777/isc12/native-sites.json",
      "siteId": "loader-count-cap",
      "rva": "0x31ED31",
      "supports": ["item-stat-cost:count"],
      "claims": { "item-stat-cost:count": "0x1260" }
    },
    {
      "id": "item-stat-cost-linker",
      "kind": "known-rva",
      "path": "reverse-engineering/d2r-3.2.92777/known-rvas.json",
      "name": "DATATBLS_ItemStatCostStatLinkerDescriptor",
      "rva": "0x31E35E",
      "supports": [
        "item-stat-cost:linker",
        "item-stat-cost:field:stat-id",
        "item-stat-cost:post-processing"
      ],
      "claims": {
        "item-stat-cost:linker": "0x1270",
        "item-stat-cost:field:stat-id": { "offset": "0x0", "size": 2, "type": "uint16_t" },
        "item-stat-cost:post-processing": true
      }
    },
    {
      "id": "item-stat-cost-fields",
      "kind": "native-site",
      "path": "reverse-engineering/d2r-3.2.92777/isc12/native-sites.json",
      "siteId": "loader-descfunc-record-layout",
      "rva": "0x31F0F1",
      "supports": ["item-stat-cost:field:desc-priority", "item-stat-cost:field:desc-func"],
      "claims": {
        "item-stat-cost:field:desc-priority": { "offset": "0x30", "size": 2, "type": "int16_t" },
        "item-stat-cost:field:desc-func": { "offset": "0x32", "size": 1, "type": "uint8_t" }
      }
    },
    {
      "id": "item-stat-cost-lifecycle",
      "kind": "known-rva",
      "path": "reverse-engineering/d2r-3.2.92777/known-rvas.json",
      "name": "DATATBLS_ItemStatCostStatLinkerTeardown",
      "rva": "0x313ACE",
      "supports": ["item-stat-cost:records", "item-stat-cost:post-processing"],
      "claims": {
        "item-stat-cost:records": "0x1258",
        "item-stat-cost:post-processing": true
      }
    },
    {
      "id": "item-types-layout",
      "kind": "json-pointer",
      "path": "reverse-engineering/d2r-3.2.92777/sdk-contribution/sdk-candidates.json",
      "pointer": "/compiledTables/1",
      "expected": {
        "name": "itemtypes",
        "recordsOffset": "0x1348",
        "countOffset": "0x1350",
        "countType": "uint64_t",
        "recordSize": "0xE8",
        "confidence": "high"
      },
      "supports": ["item-types:records", "item-types:count", "item-types:record-size"],
      "claims": {
        "item-types:records": "0x1348",
        "item-types:count": "0x1350",
        "item-types:record-size": "0xE8"
      }
    },
    {
      "id": "item-types-code",
      "kind": "text-witness",
      "path": "reverse-engineering/d2r-3.2.92777/sdk-contribution/verified-layouts.hpp",
      "needle": "std::uint32_t code;              // +0x00",
      "supports": ["item-types:field:code"],
      "claims": {
        "item-types:field:code": { "offset": "0x0", "size": 4, "type": "uint32_t" }
      }
    },
    {
      "id": "item-types-equiv1",
      "kind": "text-witness",
      "path": "reverse-engineering/d2r-3.2.92777/sdk-contribution/verified-layouts.hpp",
      "needle": "std::uint16_t equivalentTypeOne; // +0x04",
      "supports": ["item-types:field:equivalent-type-one"],
      "claims": {
        "item-types:field:equivalent-type-one": { "offset": "0x4", "size": 2, "type": "uint16_t" }
      }
    },
    {
      "id": "item-types-equiv2",
      "kind": "text-witness",
      "path": "reverse-engineering/d2r-3.2.92777/sdk-contribution/verified-layouts.hpp",
      "needle": "std::uint16_t equivalentTypeTwo; // +0x06",
      "supports": ["item-types:field:equivalent-type-two"],
      "claims": {
        "item-types:field:equivalent-type-two": { "offset": "0x6", "size": 2, "type": "uint16_t" }
      }
    },
    {
      "id": "item-types-repair",
      "kind": "text-witness",
      "path": "reverse-engineering/d2r-3.2.92777/sdk-contribution/verified-layouts.hpp",
      "needle": "std::uint8_t repair;             // +0x08",
      "supports": ["item-types:field:repair"],
      "claims": {
        "item-types:field:repair": { "offset": "0x8", "size": 1, "type": "uint8_t" }
      }
    },
    {
      "id": "objects-layout",
      "kind": "known-rva",
      "path": "reverse-engineering/d2r-3.2.92777/known-rvas.json",
      "name": "DATATBLS_GetObjectsTxtRecord",
      "rva": "0x38FD00",
      "supports": [
        "objects:records",
        "objects:count",
        "objects:record-size",
        "objects:field:sub-class",
        "objects:field:lockable",
        "objects:field:init-fn",
        "objects:field:operate-fn"
      ],
      "claims": {
        "objects:records": "0x1528",